geo_aggregation_level,industry_code,industry_complexity,industry_ubiquity,industry_centrality,industry_description
3,333514,-1.2812240880287615,188,0.0011861086716812965,"Special Die and Tool, Die Set, Jig, and Fixture Manufacturing"
3,333515,-0.18652391296785178,130,0.0011635576817157,Cutting Tool and Machine Tool Accessory Manufacturing
3,333517,-0.7806777678286204,163,0.001167286198561255,Machine Tool Manufacturing
3,333519,-0.2376900503921581,71,0.000785232117570872,Rolling Mill and Other Metalworking Machinery Manufacturing
3,333611,-0.2435652948237812,55,0.0005952763827805176,Turbine and Turbine Generator Set Units Manufacturing
3,333612,0.1427120040056777,58,0.000742825559770407,"Speed Changer, Industrial High-Speed Drive, and Gear Manufacturing"
3,333613,0.21181559606035963,81,0.0009104491674175865,Mechanical Power Transmission Equipment Manufacturing
3,333618,-1.045788094717791,53,0.0005217396306267455,Other Engine Equipment Manufacturing
3,333912,-0.4100749050838519,84,0.0008721795269642186,Air and Gas Compressor Manufacturing
3,333914,-0.6558080134343605,128,0.0010894742419470787,"Measuring, Dispensing, and Other Pumping Equipment Manufacturing"
3,333921,0.3896724985542428,51,0.0006227352684757005,Elevator and Moving Stairway Manufacturing
3,333922,-0.8960740793604436,142,0.001126500760174799,Conveyor and Conveying Equipment Manufacturing
3,333923,-0.0662314512134661,86,0.0009375609526939458,"Overhead Traveling Crane, Hoist, and Monorail System Manufacturing"
3,333924,-0.6157064827258532,93,0.0008626595914576861,"Industrial Truck, Tractor, Trailer, and Stacker Machinery Manufacturing"
3,333991,-0.026859068095478535,49,0.0005724138751542504,Power-Driven Handtool Manufacturing
3,333992,-0.13906501467050417,100,0.000978462207112223,Welding and Soldering Equipment Manufacturing
3,333993,0.08765303986978475,90,0.0009302252965345319,Packaging Machinery Manufacturing
3,333994,0.3405727969780468,68,0.0008637288427938141,Industrial Process Furnace and Oven Manufacturing
3,333995,-0.619050318148188,94,0.0009467129752400199,Fluid Power Cylinder and Actuator Manufacturing
3,333996,-0.015943351464061558,68,0.0007683028807110172,Fluid Power Pump and Motor Manufacturing
3,333998,-0.3047712221856526,166,0.0012774049376232575,All Other Miscellaneous General Purpose Machinery Manufacturing
3,334111,2.7011428981490146,32,0.0005007000408964536,Electronic Computer Manufacturing
3,334112,2.770463368926725,20,0.00032794843831551913,Computer Storage Device Manufacturing
3,334118,1.7219706179501615,60,0.0008091940631994558,Computer Terminal and Other Computer Peripheral Equipment Manufacturing
3,334210,2.198499068490445,40,0.0005871061323543137,Telephone Apparatus Manufacturing
3,334220,1.4185343759338485,75,0.0008683832344690901,Radio and Television Broadcasting and Wireless Communications Equipment Manufacturing
3,334290,1.3132178296416481,68,0.0009247480605087033,Other Communications Equipment Manufacturing
3,334310,1.9649840305689217,58,0.0007994275203965331,Audio and Video Equipment Manufacturing
3,334412,1.6651459588159623,46,0.000659452492879723,Bare Printed Circuit Board Manufacturing
3,334413,1.99903878879383,43,0.0005904485783477406,Semiconductor and Related Device Manufacturing
3,334416,0.9690251723801522,73,0.0008730132817864121,"Capacitor, Resistor, Coil, Transformer, and Other Inductor Manufacturing"
3,334417,1.6066456357350802,55,0.0007419881884220146,Electronic Connector Manufacturing
3,334418,0.9382930907195938,105,0.001108275444932329,Printed Circuit Assembly (Electronic Assembly) Manufacturing
3,334419,0.6299363121745482,117,0.001107731152833506,Other Electronic Component Manufacturing
3,334510,1.8657481159419484,43,0.0006409588004628272,Electromedical and Electrotherapeutic Apparatus Manufacturing
3,334511,1.4082753076792347,60,0.0007567681212315154,"Search, Detection, Navigation, Guidance, Aeronautical, and Nautical System and Instrument Manufacturing"
3,334512,0.24683535497437903,73,0.0008324832306277968,"Automatic Environmental Control Manufacturing for Residential, Commercial, and Appliance Use"
3,334513,0.24162172608539004,136,0.0011441280299635717,"Instruments and Related Products Manufacturing for Measuring, Displaying, and Controlling Industrial Process Variables"
3,334514,1.1046043568463926,54,0.0007173068482379907,Totalizing Fluid Meter and Counting Device Manufacturing
3,334515,1.0425228414505094,72,0.0007744928560049849,Instrument Manufacturing for Measuring and Testing Electricity and Electrical Signals
3,334516,2.4433448672904996,69,0.0008789525328027232,Analytical Laboratory Instrument Manufacturing
3,334517,3.2425968856014795,27,0.0004925603657672205,Irradiation Apparatus Manufacturing
3,334519,1.1170774192479007,91,0.0009986279927862685,Other Measuring and Controlling Device Manufacturing
3,334610,2.089596476411006,57,0.0007649685935245482,Manufacturing and Reproducing Magnetic and Optical Media
3,335131,0.7306606013499767,72,0.0008329220587822565,Residential Electric Lighting Fixture Manufacturing
3,335132,0.3751978859690953,84,0.0009442798218375413,"Commercial, Industrial, and Institutional Electric Lighting Fixture Manufacturing"
3,335139,0.4678559349884928,63,0.0007760444131928468,Electric Lamp Bulb and Other Lighting Equipment Manufacturing
3,335210,0.20333959090067832,60,0.0006621621389718477,Small Electrical Appliance Manufacturing
3,335220,-0.72673309883541,48,0.0005086103508983656,Major Household Appliance Manufacturing
3,335311,-0.44919303644671865,69,0.0007622377377087594,"Power, Distribution, and Specialty Transformer Manufacturing"
3,335312,-0.3913782238618876,107,0.0009948723995456283,Motor and Generator Manufacturing
3,335313,-0.14739164623438075,104,0.0010463953650186794,Switchgear and Switchboard Apparatus Manufacturing
3,335314,-0.11298420528477209,95,0.0009439211189605688,Relay and Industrial Control Manufacturing
3,335910,-0.1760714253750525,65,0.0006913348746981827,Battery Manufacturing
3,335921,1.6032119375209557,43,0.000616366245657265,Fiber Optic Cable Manufacturing
3,335929,0.8269088750431564,71,0.000893104618511182,Other Communication and Energy Wire Manufacturing
3,335931,0.273628403550679,94,0.000991638882704858,Current-Carrying Wiring Device Manufacturing
3,335932,0.23372694496550814,51,0.0006195781185046644,Noncurrent-Carrying Wiring Device Manufacturing
3,335991,0.8405426631287746,52,0.0006786365848105492,Carbon and Graphite Product Manufacturing
3,335999,0.6075696735552794,129,0.0012023470890570986,All Other Miscellaneous Electrical Equipment and Component Manufacturing
3,336110,0.040320021164922636,40,0.0005198258765862572,Automobile and Light Duty Motor Vehicle Manufacturing
3,336120,-0.18424366321906682,54,0.0006346419200747576,Heavy Duty Truck Manufacturing
3,336211,-1.278444501005534,147,0.001071174584354568,Motor Vehicle Body Manufacturing
3,336212,-1.5404166362566365,137,0.0009679835460449436,Truck Trailer Manufacturing
3,336213,-0.6569158927758839,17,0.0001797339811899282,Motor Home Manufacturing
3,336214,-1.1985628931129892,111,0.0008694386822113974,Travel Trailer and Camper Manufacturing
3,336310,-1.1138238701904926,136,0.0009655947437521773,Motor Vehicle Gasoline Engine and Engine Parts Manufacturing
3,336320,-0.97142264949804,116,0.0009601798159602412,Motor Vehicle Electrical and Electronic Equipment Manufacturing
3,336330,-0.6612466181357368,78,0.0007597327045633903,Motor Vehicle Steering and Suspension Components (except Spring) Manufacturing
3,336340,-0.23514606519526735,59,0.0006802129431278175,Motor Vehicle Brake System Manufacturing
3,336350,-0.9155870961600859,97,0.0008752779566945948,Motor Vehicle Transmission and Power Train Parts Manufacturing
3,336360,-0.8637368549174963,97,0.0008963678964871686,Motor Vehicle Seating and Interior Trim Manufacturing
3,336370,-1.0212209341839598,102,0.0008911504336147274,Motor Vehicle Metal Stamping
3,336390,-1.2333395831436489,189,0.0011631972018731102,Other Motor Vehicle Parts Manufacturing
3,336411,0.47049350314904,56,0.0006528717542091632,Aircraft Manufacturing
3,336412,0.44667619346469195,81,0.0008853025523801796,Aircraft Engine and Engine Parts Manufacturing
3,336413,0.3560909541146243,112,0.0010512990393704012,Other Aircraft Parts and Auxiliary Equipment Manufacturing
3,336414,3.0452456453879586,24,0.00037708025932280175,Guided Missile and Space Vehicle Manufacturing
3,336415,1.4743068510177977,26,0.0003362733180503344,Guided Missile and Space Vehicle Propulsion Unit and Propulsion Unit Parts Manufacturing
3,336419,1.9170409556292498,17,0.00027106217009713253,Other Guided Missile and Space Vehicle Parts and Auxiliary Equipment Manufacturing
3,336510,-0.6238792763297267,72,0.0007265701980802289,Railroad Rolling Stock Manufacturing
3,336611,0.39112392386666595,53,0.000528871726308093,Ship Building and Repairing
3,336612,-0.08586124788193893,131,0.0010036804059095118,Boat Building
3,336991,0.9200600734745882,74,0.0008842940196651543,"Motorcycle, Bicycle, and Parts Manufacturing"
3,336992,1.0404615450513108,25,0.0003380677313204722,"Military Armored Vehicle, Tank, and Tank Component Manufacturing"
3,336999,-0.5992848998784868,83,0.0007462677441548504,All Other Transportation Equipment Manufacturing
3,337110,-1.0656983785696656,289,0.0013610102363610021,Wood Kitchen Cabinet and Countertop Manufacturing
3,337121,-0.8778191979845631,48,0.0004847571645333939,Upholstered Household Furniture Manufacturing
3,337122,-0.49982950975873985,190,0.0012096033494076652,Nonupholstered Wood Household Furniture Manufacturing
3,337126,0.19576480446774577,94,0.0009842337731870415,Household Furniture (except Wood and Upholstered) Manufacturing
3,337127,-0.670934707506772,104,0.000944603945143983,Institutional Furniture Manufacturing
3,337211,-0.21104683399687815,73,0.000767247956614384,Wood Office Furniture Manufacturing
3,337212,0.5995183784848769,186,0.0014472564495187142,Custom Architectural Woodwork and Millwork Manufacturing
3,337214,0.25085259768326845,42,0.0005289121314893728,Office Furniture (except Wood) Manufacturing
3,337215,-0.3370436783887347,126,0.0011252641240612517,"Showcase, Partition, Shelving, and Locker Manufacturing"
3,337910,0.10610785971883603,95,0.0010058951062400395,Mattress Manufacturing
3,337920,0.9920780921772293,69,0.0008465842566322517,Blind and Shade Manufacturing
3,339112,1.0734662534700161,85,0.0009714950878098895,Surgical and Medical Instrument Manufacturing
3,339113,0.18973392002894188,132,0.001131944643816838,Surgical Appliance and Supplies Manufacturing
3,339114,1.5275218915802995,57,0.0008215920403670119,Dental Equipment and Supplies Manufacturing
3,339115,0.5213351466655974,62,0.0007703460010782736,Ophthalmic Goods Manufacturing
3,339116,-0.1672611881229465,176,0.0012829042247586159,Dental Laboratories
3,339910,0.6091845644631217,113,0.0009668482978756618,Jewelry and Silverware Manufacturing
3,339920,-0.2659379401759026,203,0.0012607718721483708,Sporting and Athletic Goods Manufacturing
3,339930,0.24613636874567332,116,0.0009945754396874448,"Doll, Toy, and Game Manufacturing"
3,339940,0.008364411902007107,83,0.0009123626034346444,Office Supplies (except Paper) Manufacturing
3,339950,-0.5784356169263538,275,0.0014776061987688289,Sign Manufacturing
3,339991,-0.28182884194201463,108,0.0010634876289707012,"Gasket, Packing, and Sealing Device Manufacturing"
3,339992,0.6731282714334174,114,0.0010342005477370383,Musical Instrument Manufacturing
3,339993,1.051649833958613,45,0.0006170357473090797,"Fastener, Button, Needle, and Pin Manufacturing"
3,339994,-0.11984902395010671,59,0.0006731075044429805,"Broom, Brush, and Mop Manufacturing"
3,339995,-0.6617278048481913,47,0.00048087412973096756,Burial Casket Manufacturing
3,339999,-0.47191784262444514,223,0.00131527981761639,All Other Miscellaneous Manufacturing
3,423110,-0.9381899073656133,288,0.0015156746909334776,Automobile and Other Motor Vehicle Merchant Wholesalers
3,423120,-1.0813501546830417,235,0.0013575736795419847,Motor Vehicle Supplies and New Parts Merchant Wholesalers
3,423130,-0.4912061037412615,182,0.0013585181492853059,Tire and Tube Merchant Wholesalers
3,423140,-0.7710856850656524,260,0.0013965815591982708,Motor Vehicle Parts (Used) Merchant Wholesalers
3,423210,0.6658286463152948,96,0.001056309618468392,Furniture Merchant Wholesalers
3,423220,0.22886882583166532,101,0.0010379539905559015,Home Furnishing Merchant Wholesalers
3,423310,-0.6724362166042204,235,0.0013839721063729452,"Lumber, Plywood, Millwork, and Wood Panel Merchant Wholesalers"
3,423320,-0.20607551297023788,215,0.0014068549108416485,"Brick, Stone, and Related Construction Material Merchant Wholesalers"
3,423330,0.03127279628023078,233,0.0015612505514334776,"Roofing, Siding, and Insulation Material Merchant Wholesalers"
3,423390,-0.3313000291223478,198,0.0013504529004694683,Other Construction Material Merchant Wholesalers
3,423410,1.3285700033618313,50,0.0006616642875804399,Photographic Equipment and Supplies Merchant Wholesalers
3,423420,0.19631674284928247,149,0.0013048991447151697,Office Equipment Merchant Wholesalers
3,423430,2.102383437225254,53,0.000782907826717404,Computer and Computer Peripheral Equipment and Software Merchant Wholesalers
3,423440,0.1531142798302655,140,0.0012751931540934888,Other Commercial Equipment Merchant Wholesalers
3,423450,0.7342895550535181,92,0.0010849282565719557,"Medical, Dental, and Hospital Equipment and Supplies Merchant Wholesalers"
3,423460,0.8474145657532807,68,0.0008610811738514588,Ophthalmic Goods Merchant Wholesalers
3,423490,0.9225130185615031,106,0.0011413441917894802,Other Professional Equipment and Supplies Merchant Wholesalers
3,423510,-1.2310717528253876,226,0.001323395839900354,Metal Service Centers and Other Metal Merchant Wholesalers
3,423520,-0.05229786482452506,76,0.000795928906595329,Coal and Other Mineral and Ore Merchant Wholesalers
3,423610,-0.7548234480820611,238,0.0014049312093882254,"Electrical Apparatus and Equipment, Wiring Supplies, and Related Equipment Merchant Wholesalers"
3,423620,0.705909294669396,83,0.0009755276589509152,"Household Appliances, Electric Housewares, and Consumer Electronics Merchant Wholesalers"
3,423690,1.4081575835941558,71,0.0009368680474121276,Other Electronic Parts and Equipment Merchant Wholesalers
3,423710,-0.5100176788702763,166,0.001294461841905139,Hardware Merchant Wholesalers
3,423720,-0.41541916725142336,285,0.0015242826755947842,Plumbing and Heating Equipment and Supplies (Hydronics) Merchant Wholesalers
3,423730,0.029040537141809007,158,0.0013444581888734668,Warm Air Heating and Air-Conditioning Equipment and Supplies Merchant Wholesalers
3,423740,0.08833724903637347,143,0.0012969182891717469,Refrigeration Equipment and Supplies Merchant Wholesalers
3,423810,-0.8463811800183877,324,0.001505496826033942,Construction and Mining (except Oil Well) Machinery and Equipment Merchant Wholesalers
3,423820,-1.8307600591987756,481,0.0013446081236107362,Farm and Garden Machinery and Equipment Merchant Wholesalers
3,423830,-1.109326785225564,236,0.0013863120062971481,Industrial Machinery and Equipment Merchant Wholesalers
3,423840,-1.0912024144867467,261,0.0014027138472721091,Industrial Supplies Merchant Wholesalers
3,423850,-0.7778382444156055,250,0.0014307398718499892,Service Establishment Equipment and Supplies Merchant Wholesalers
3,423860,-0.028274197737918068,138,0.0011504910184549659,Transportation Equipment and Supplies (except Motor Vehicle) Merchant Wholesalers
3,423910,0.23884091643349917,196,0.001366055344402292,Sporting and Recreational Goods and Supplies Merchant Wholesalers
3,423920,0.2558560986624373,86,0.0009518888560710715,Toy and Hobby Goods and Supplies Merchant Wholesalers
3,423930,-1.5241874543769485,397,0.0014344585995126231,Recyclable Material Merchant Wholesalers
3,423940,0.9337592719948826,57,0.0006263098807419867,"Jewelry, Watch, Precious Stone, and Precious Metal Merchant Wholesalers"
3,423990,-0.6886706184065413,187,0.0012266098204755482,Other Miscellaneous Durable Goods Merchant Wholesalers
3,424110,0.8999812744579874,79,0.001014393244076014,Printing and Writing Paper Merchant Wholesalers
3,424120,0.11132063850268022,118,0.0010651124368958066,Stationery and Office Supplies Merchant Wholesalers
3,424130,-0.016593651237378455,141,0.0012136308272613036,Industrial and Personal Service Paper Merchant Wholesalers
3,424210,0.8141679864493777,81,0.0009405577954472738,Drugs and Druggists' Sundries Merchant Wholesalers
3,424310,0.544547972888548,75,0.0008825608251749413,"Piece Goods, Notions, and Other Dry Goods Merchant Wholesalers"
3,424340,1.50562434773374,54,0.0006986433073402996,Footwear Merchant Wholesalers
3,424350,0.6991776331508647,70,0.0008020370126957569,Clothing and Clothing Accessories Merchant Wholesalers
3,424410,-0.16730849245445317,193,0.0013733192785984605,General Line Grocery Merchant Wholesalers
3,424420,0.31571034834528927,113,0.0011404412031387017,Packaged Frozen Food Merchant Wholesalers
3,424430,-0.5847118041477716,176,0.001249514922706845,Dairy Product (except Dried or Canned) Merchant Wholesalers
3,424440,-0.3877886738700966,96,0.0009057961775835934,Poultry and Poultry Product Merchant Wholesalers
3,424450,-1.0158999982845258,337,0.0014055730401353697,Confectionery Merchant Wholesalers
3,424460,1.7634563320377608,89,0.0009726638689663089,Fish and Seafood Merchant Wholesalers
3,424470,-0.05041789438788965,124,0.001094042370071416,Meat and Meat Product Merchant Wholesalers
3,424480,0.44368835779704113,117,0.0010389147630969725,Fresh Fruit and Vegetable Merchant Wholesalers
3,424490,-0.4782960221582258,328,0.0015366514807432184,Other Grocery and Related Products Merchant Wholesalers
3,424510,-2.1750084494043365,255,0.0010620501535898341,Grain and Field Bean Merchant Wholesalers
3,424520,-1.7805820103984624,279,0.0011964844725379353,Livestock Merchant Wholesalers
3,424590,-0.31853311916192256,168,0.0011598662587343068,Other Farm Product Raw Material Merchant Wholesalers
3,424610,-0.555077101479267,119,0.0010715951533460696,Plastics Materials and Basic Forms and Shapes Merchant Wholesalers
3,424690,-1.2312289941554941,236,0.0012927280737298937,Other Chemical and Allied Products Merchant Wholesalers
3,424710,-1.565172579947863,357,0.0013558864514436315,Petroleum Bulk Stations and Terminals
3,424720,-1.4456599221965138,339,0.001352601100356896,Petroleum and Petroleum Products Merchant Wholesalers (except Bulk Stations and Terminals)
3,424810,-0.3764489533697227,357,0.0015634661376565087,Beer and Ale Merchant Wholesalers
3,424820,0.9470723602570774,126,0.0012460710433220938,Wine and Distilled Alcoholic Beverage Merchant Wholesalers
3,424910,-1.790353222088992,441,0.001322738999066899,Farm Supplies Merchant Wholesalers
3,424920,-0.012828044305892803,92,0.0009021456726106651,"Book, Periodical, and Newspaper Merchant Wholesalers"
3,424930,-0.1549378680185117,163,0.0011847247695286282,"Flower, Nursery Stock, and Florists' Supplies Merchant Wholesalers"
3,424940,-0.3032083172403589,137,0.0011493293317381987,Tobacco Product and Electronic Cigarette Merchant Wholesalers
3,424950,0.030105284889788753,150,0.0012647068239852856,"Paint, Varnish, and Supplies Merchant Wholesalers"
3,424990,0.2792806411391352,141,0.0011488744639322657,Other Miscellaneous Nondurable Goods Merchant Wholesalers
3,425120,-0.15038254798538886,70,0.0007536448913182419,Wholesale Trade Agents and Brokers
3,441110,-0.9657548747640001,577,0.001526108857660215,New Car Dealers
3,441120,-1.293501134990717,444,0.0014756359916210323,Used Car Dealers
3,441210,-0.7887950605225992,360,0.0015359165843301513,Recreational Vehicle Dealers
3,441222,-0.3500155053024607,283,0.0014016944772839584,Boat Dealers
3,441227,-1.0794591215030296,526,0.0014960917773032664,"Motorcycle, ATV, and All Other Motor Vehicle Dealers"
3,441330,-1.3425724129850949,670,0.0014412370839591308,Automotive Parts and Accessories Retailers
3,441340,-1.0570344235926594,596,0.00148373881148819,Tire Dealers
3,444110,-0.9241839464699255,652,0.001498794990407708,Home Centers
3,444120,-0.6854920870256556,411,0.0015034553439676832,Paint and Wallpaper Retailers
3,444140,-1.2068454618013855,659,0.0014266812337785483,Hardware Retailers
3,444180,-0.7212614730466035,445,0.0015300086080469236,Other Building Material Dealers
3,444230,-1.00443305058461,448,0.0014821797110242888,Outdoor Power Equipment Retailers
3,444240,-1.3265416473449039,666,0.0014010395206917902,"Nursery, Garden Center, and Farm Supply Retailers"
3,445110,-0.337937646089758,443,0.0014923052169508115,Supermarkets and Other Grocery (except Convenience) Stores
3,445131,-0.5538066001955112,300,0.0013421222258402847,Convenience Retailers
3,445132,-0.8411039605917594,302,0.0014488420417009028,Vending Machine Operators
3,445230,0.0889597795599677,197,0.0013111176576340307,Fruit and Vegetable Retailers
3,445240,-1.258826613974302,334,0.0013866611790022815,Meat Retailers
3,445250,0.9538028496012552,151,0.0011704912727796824,Fish and Seafood Retailers
3,445291,0.002796840445660912,198,0.0012966880127753086,Baked Goods Retailers
3,445292,0.3305819263404849,219,0.001386971537827307,Confectionery and Nut Retailers
3,445298,-0.11149848013847084,339,0.0014563442021651505,All Other Specialty Food Retailers
3,445320,-0.8373667602525254,412,0.001421933916558562,"Beer, Wine, and Liquor Retailers"
3,449110,-0.9083164643875336,410,0.001499933580007787,Furniture Retailers
3,449121,-0.7857866154502612,446,0.0014790935620574255,Floor Covering Retailers
3,449122,1.0932238518408444,167,0.0013487099753234323,Window Treatment Retailers
3,449129,0.9622562511423509,220,0.0014624284119880066,All Other Home Furnishings Retailers
3,449210,-0.25838508892848217,223,0.001403141762619432,Electronics and Appliance Retailers
3,455110,-0.02233982087134312,278,0.0014602582307403464,Department Stores
3,455211,-1.352480120412711,753,0.0014278200666372944,Warehouse Clubs and Supercenters
3,455219,-1.5508558921616693,681,0.001380446606645558,All Other General Merchandise Retailers
3,456110,-1.2067652461391742,405,0.0014205628027207469,Pharmacies and Drug Retailers
3,456120,-0.21702484920752035,263,0.0014232497347477352,"Cosmetics, Beauty Supplies, and Perfume Retailers"
3,456130,0.16723263645154698,209,0.0014011239828904828,Optical Goods Retailers
3,456191,-0.46016289538896227,306,0.0014167602739927974,Food (Health) Supplement Retailers
3,456199,-0.7579276583015746,315,0.0014382091352202861,All Other Health and Personal Care Retailers
3,457110,-1.4819197465379153,747,0.001388849793888708,Gasoline Stations with Convenience Stores
3,457120,-1.463804374178053,377,0.0013456029760627475,Other Gasoline Stations
3,457210,-1.1212388237587678,400,0.0013453483744233093,Fuel Dealers
3,458110,0.6340991448018931,195,0.001356842232237421,Clothing and Clothing Accessories Retailers
3,458210,0.14003724159427855,188,0.0013029405883926402,Shoe Retailers
3,458310,0.23597724552048996,263,0.0014115193384497703,Jewelry Retailers
3,458320,1.5610443628214858,102,0.0009892491814185243,Luggage and Leather Goods Retailers
3,459110,-0.222043876711912,425,0.0015782892661733304,Sporting Goods Retailers
3,459120,-0.3187160382171544,421,0.0016049438500890943,"Hobby, Toy, and Game Retailers"
3,459130,-0.4855779257482926,440,0.0015431157476931098,"Sewing, Needlework, and Piece Goods Retailers"
3,459140,-0.15304080301598966,252,0.0014633796608842001,Musical Instrument and Supplies Retailers
3,459210,0.1987441223293338,316,0.0014788620274417221,Book Retailers and News Dealers
3,459310,-0.883839294956953,471,0.0014779433612726136,Florists
3,459410,-0.4587744892635712,361,0.0015132756080346698,Office Supplies and Stationery Retailers
3,459420,0.02746369373790842,309,0.0014590722841259958,"Gift, Novelty, and Souvenir Retailers"
3,459510,-0.5699679021406338,436,0.0015453543222781214,Used Merchandise Retailers
3,459910,0.2575926126772444,323,0.0015990553422725606,Pet and Pet Supplies Retailers
3,459920,0.8765252075658044,190,0.0012386845391111061,Art Dealers
3,459930,-1.161514716772899,364,0.0014028132847661858,Manufactured (Mobile) Home Dealers
3,459991,-0.9279731497631831,481,0.0014389127906783664,"Tobacco, Electronic Cigarette, and Other Smoking Supplies Retailers"
3,459999,-0.4181930035406127,305,0.0014429389943090324,All Other Miscellaneous Retailers
3,481111,3.4774672273896323,36,0.0006237695736149244,Scheduled Passenger Air Transportation
3,481112,1.3644945685729384,34,0.0004864789375522622,Scheduled Freight Air Transportation
3,481211,0.20222097562002492,114,0.0009641042373181217,Nonscheduled Chartered Passenger Air Transportation
3,481212,1.1657627555270995,52,0.0006287577497115743,Nonscheduled Chartered Freight Air Transportation
3,481219,0.8518648388560591,114,0.0010971511400070415,Other Nonscheduled Air Transportation
3,482110,-1.6005196128047678,399,0.0013647757434494415,Rail transportation
3,483111,1.9391308884251697,28,0.00041248875119164353,Deep Sea Freight Transportation
3,483112,3.6285494349109224,12,0.0001911314203062489,Deep Sea Passenger Transportation
3,483113,1.3889971220407704,46,0.0005609642517461211,Coastal and Great Lakes Freight Transportation
3,483114,1.936690938492921,44,0.0005106634697529572,Coastal and Great Lakes Passenger Transportation
3,483211,-0.25726541011418785,60,0.0006427864166949133,Inland Water Freight Transportation
3,483212,1.6987679849215733,63,0.000727014937901389,Inland Water Passenger Transportation
3,484110,-1.5979181451677846,338,0.0013254335894930713,"General Freight Trucking, Local"
3,484121,-1.8045257883085446,405,0.0013787505055758633,"General Freight Trucking, Long-Distance, Truckload"
3,484122,-0.8269614499050406,252,0.0014460944560106463,"General Freight Trucking, Long-Distance, Less Than Truckload"
3,484210,0.6058997029175236,247,0.0014990183874667357,Used Household and Office Goods Moving
3,484220,-1.5928686975761874,521,0.0013920858949027168,"Specialized Freight (except Used Goods) Trucking, Local"
3,484230,-1.764896903368195,340,0.0013590748037364353,"Specialized Freight (except Used Goods) Trucking, Long-Distance"
