geo_aggregation_level,industry_code,industry_complexity,industry_ubiquity,industry_centrality,industry_description
2,321991,-0.7894018626111243,13,0.0009733304576108688,Manufactured Home (Mobile Home) Manufacturing
2,321992,-0.08573278789344052,22,0.001189556411600471,Prefabricated Wood Building Manufacturing
2,321999,-1.1970356430796774,22,0.0013131798738723528,All Other Miscellaneous Wood Product Manufacturing
2,322110,-1.5885398421344794,8,0.000636236029803029,Pulp Mills
2,322120,-0.6128125203438054,21,0.0012677848721066231,Paper Mills
2,322130,-1.0414457387327813,19,0.0012363000819725696,Paperboard Mills
2,322211,-1.8798379176221958,18,0.0012914881089749882,Corrugated and Solid Fiber Box Manufacturing
2,322212,-1.7623993832507834,15,0.0011326026471283044,Folding Paperboard Box Manufacturing
2,322219,-1.708077465482488,15,0.0011847458087134069,Other Paperboard Container Manufacturing
2,322220,-1.0107807129020032,18,0.001284378631730725,Paper Bag and Coated and Treated Paper Manufacturing
2,322230,-0.9552713210126572,18,0.0012296780980517584,Stationery Product Manufacturing
2,322291,-0.6125265307093399,17,0.0011683447803225988,Sanitary Paper Product Manufacturing
2,322299,-1.4909124766878117,14,0.0011237928010161804,All Other Converted Paper Product Manufacturing
2,323111,-0.7952096008046438,23,0.001327171290846265,Commercial Printing (except Screen and Books)
2,323113,-1.1818268583161398,23,0.0012829305572854897,Commercial Screen Printing
2,323117,-0.862648116793282,15,0.001107176058630714,Books Printing
2,323120,-0.7026682606261659,19,0.0012663939356483593,Support Activities for Printing
2,324110,0.10233590729477332,18,0.0010593887111096517,Petroleum Refineries
2,324121,0.02423308869196847,22,0.00125235601650049,Asphalt Paving Mixture and Block Manufacturing
2,324122,-0.4272240624231564,21,0.001246833192702642,Asphalt Shingle and Coating Materials Manufacturing
2,324191,-1.3483926932148724,17,0.0011989491748981653,Petroleum Lubricating Oil and Grease Manufacturing
2,324199,-1.5111703993947534,10,0.0008080169526530406,All Other Petroleum and Coal Products Manufacturing
2,325110,-1.3175590491699372,4,0.0002938253983272969,Petrochemical Manufacturing
2,325120,-0.04949220482098466,16,0.0011412548443845178,Industrial Gas Manufacturing
2,325130,-1.100179535413859,17,0.0012037838968332137,Synthetic Dye and Pigment Manufacturing
2,325180,-0.882694847699506,19,0.0011599175935200696,Other Basic Inorganic Chemical Manufacturing
2,325193,-1.628708037144608,11,0.0008202954502445261,Ethyl Alcohol Manufacturing
2,325194,-1.170787160467471,14,0.0010877735226251216,"Cyclic Crude, Intermediate, and Gum and Wood Chemical Manufacturing"
2,325199,-1.5126650838484592,17,0.001149207933289316,All Other Basic Organic Chemical Manufacturing
2,325211,-1.304513738318531,16,0.001135555648807546,Plastics Material and Resin Manufacturing
2,325212,-0.23658574670530286,11,0.0008379543702063966,Synthetic Rubber Manufacturing
2,325220,-1.0175038189991723,8,0.0006272222327568789,Artificial and Synthetic Fibers and Filaments Manufacturing
2,325311,-1.1187722253874077,15,0.0009858680561530071,Nitrogenous Fertilizer Manufacturing
2,325312,-0.5525330646140424,7,0.0004959111551453639,Phosphatic Fertilizer Manufacturing
2,325314,-0.6301097797929,18,0.0012215638799888506,Fertilizer (Mixing Only) Manufacturing
2,325315,0.617955062143639,14,0.0010344525334630764,Compost Manufacturing
2,325320,-1.8915950729826487,13,0.0010048449646599227,Pesticide and Other Agricultural Chemical Manufacturing
2,325411,0.6776450873064417,12,0.0008904670106147824,Medicinal and Botanical Manufacturing
2,325412,0.14437823468729022,13,0.0010222540041868588,Pharmaceutical Preparation Manufacturing
2,325413,0.7175306349033969,12,0.0008818508807934499,In-Vitro Diagnostic Substance Manufacturing
2,325414,0.17314462372148381,17,0.0010508542060739335,Biological Product (except Diagnostic) Manufacturing
2,325510,-1.3092704644165511,16,0.0012164249669062567,Paint and Coating Manufacturing
2,325520,-0.7698291129454687,16,0.0012145832159133352,Adhesive Manufacturing
2,325611,-0.8575081229942358,17,0.0012255119792123148,Soap and Other Detergent Manufacturing
2,325612,-1.121883345609666,13,0.001034243065412781,Polish and Other Sanitation Good Manufacturing
2,325613,-0.2778978752302557,12,0.0009486542453091915,Surface Active Agent Manufacturing
2,325620,-0.33651530299455057,14,0.0010996488651387921,Toilet Preparation Manufacturing
2,325910,-0.965509947392804,14,0.001069763918561766,Printing Ink Manufacturing
2,325920,-0.6197556254080245,13,0.0009422166776406173,Explosives Manufacturing
2,325991,-0.6455059151835025,16,0.0011929558157216852,Custom Compounding of Purchased Resins
2,325992,0.28351634013341953,12,0.000904943368888964,"Photographic Film, Paper, Plate, Chemical, and Copy Toner Manufacturing"
2,325998,-0.8709911604608823,20,0.0012243640673977635,All Other Miscellaneous Chemical Product and Preparation Manufacturing
2,326111,-0.8401917485055465,16,0.001175419781627498,Plastics Bag and Pouch Manufacturing
2,326112,-1.6960020092473018,13,0.0010043296144246323,Plastics Packaging Film and Sheet (including Laminated) Manufacturing
2,326113,-1.0336505133622296,19,0.001214343029616075,Unlaminated Plastics Film and Sheet (except Packaging) Manufacturing
2,326121,-0.48400741941771397,16,0.0012121213448942488,Unlaminated Plastics Profile Shape Manufacturing
2,326122,-1.2274660988092279,19,0.0011905381111240098,Plastics Pipe and Pipe Fitting Manufacturing
2,326130,-0.6521580616351276,23,0.001274993219703514,"Laminated Plastics Plate, Sheet (except Packaging), and Shape Manufacturing"
2,326140,-1.1743513358298028,14,0.0010785500974065908,Polystyrene Foam Product Manufacturing
2,326150,-1.3371383729733135,20,0.0012720443426679868,Urethane and Other Foam Product (except Polystyrene) Manufacturing
2,326160,-1.4380610677784704,14,0.0011144578932235614,Plastics Bottle Manufacturing
2,326191,-1.3395286547591534,13,0.0009956587955801276,Plastics Plumbing Fixture Manufacturing
2,326199,-1.5801886646808405,19,0.0012760124689253167,All Other Plastics Product Manufacturing
2,326211,-1.763812196112498,14,0.0010536618036816954,Tire Manufacturing (except Retreading)
2,326212,-0.5617577105583503,23,0.0012836821226040976,Tire Retreading
2,326220,-1.5094703038471384,19,0.0012571437937568847,Rubber and Plastics Hoses and Belting Manufacturing
2,326291,-1.4716106400088182,11,0.0008660401004476065,Rubber Product Manufacturing for Mechanical Use
2,326299,-0.9375381504990615,24,0.0012995327745785614,All Other Rubber Product Manufacturing
2,327110,-0.0938209126665762,19,0.001211679271748642,"Pottery, Ceramics, and Plumbing Fixture Manufacturing"
2,327120,-1.6016672656425017,18,0.0011734674501929073,Clay Building Material and Refractories Manufacturing
2,327211,-0.9730501388384278,17,0.0012130194529762699,Flat Glass Manufacturing
2,327212,0.2685247340112727,11,0.0008405144557975282,Other Pressed and Blown Glass and Glassware Manufacturing
2,327213,-0.6002994099028656,15,0.0011734731346193306,Glass Container Manufacturing
2,327215,-1.124599942098026,15,0.0011232781284882746,Glass Product Manufacturing Made of Purchased Glass
2,327310,-0.9455579175681635,23,0.0012726235791483426,Cement Manufacturing
2,327320,-0.7728127326355572,29,0.0012532204178542059,Ready-Mix Concrete Manufacturing
2,327331,-0.5099645251242068,20,0.0012252759852475852,Concrete Block and Brick Manufacturing
2,327332,-0.5044114930923304,20,0.0011925570275017157,Concrete Pipe Manufacturing
2,327390,-0.4344451259072609,26,0.0013123761601571738,Other Concrete Product Manufacturing
2,327410,-0.9157455247818829,17,0.0011666813784824005,Lime Manufacturing
2,327420,-0.6845003356564204,18,0.0011210418732065513,Gypsum Product Manufacturing
2,327910,-0.45109536366982395,17,0.0011953385617849035,Abrasive Product Manufacturing
2,327991,-0.36214500484009804,25,0.0013033596430790417,Cut Stone and Stone Product Manufacturing
2,327992,-0.929537694848677,15,0.0010418700473526009,Ground or Treated Mineral and Earth Manufacturing
2,327993,-1.6304797529258954,15,0.0011236323765140676,Mineral Wool Manufacturing
2,327999,-0.7911601723467301,15,0.0011395558550383194,All Other Miscellaneous Nonmetallic Mineral Product Manufacturing
2,331110,-2.0725091238594855,12,0.0009638602129512433,Iron and Steel Mills and Ferroalloy Manufacturing
2,331210,-1.3842271551485448,19,0.0012179402957945588,Iron and Steel Pipe and Tube Manufacturing from Purchased Steel
2,331221,-1.236875777730319,18,0.0012462682736273203,Rolled Steel Shape Manufacturing
2,331222,-1.822894250244172,13,0.0010456533094821635,Steel Wire Drawing
2,331313,-0.8682658913022272,12,0.0009268431153291091,Alumina Refining and Primary Aluminum Production
2,331314,-1.3295610625022052,11,0.0008596661859461564,Secondary Smelting and Alloying of Aluminum
2,331315,-1.244808197339227,11,0.0008541783666223644,"Aluminum Sheet, Plate, and Foil Manufacturing"
2,331318,-1.342312680385549,16,0.001215957795705906,"Other Aluminum Rolling, Drawing, and Extruding"
2,331410,-0.07003133304570049,16,0.001137012700399177,Nonferrous Metal (except Aluminum) Smelting and Refining
2,331420,-0.9330047582757726,20,0.0012659452806615967,"Copper Rolling, Drawing, Extruding, and Alloying"
2,331491,-0.46743112756574656,16,0.0011044035115586497,"Nonferrous Metal (except Copper and Aluminum) Rolling, Drawing, and Extruding"
2,331492,-0.7651804332214849,16,0.0011298430543679812,"Secondary Smelting, Refining, and Alloying of Nonferrous Metal (except Copper and Aluminum)"
2,331511,-1.6451896971108135,12,0.0010058951080835997,Iron Foundries
2,331512,-0.7966846153541327,13,0.0010105270511389843,Steel Investment Foundries
2,331513,-1.3528762860159245,13,0.001036111162558162,Steel Foundries (except Investment)
2,331523,-1.2936891465279605,19,0.0012633970232147939,Nonferrous Metal Die-Casting Foundries
2,331524,-1.3859161083662406,12,0.0009930169305815914,Aluminum Foundries (except Die-Casting)
2,331529,-0.8126970659453351,13,0.0010349831239954454,Other Nonferrous Metal Foundries (except Die-Casting)
2,332111,-1.3222250100721744,12,0.0010097270248837853,Iron and Steel Forging
2,332112,-0.25894255609272804,8,0.000658095734863945,Nonferrous Forging
2,332114,-1.0124457869882892,9,0.0007853076513930159,Custom Roll Forming
2,332117,-0.9300702182508656,10,0.0007880969890254306,Powder Metallurgy Part Manufacturing
2,332119,-0.5590945060394622,15,0.001147701509081216,"Metal Crown, Closure, and Other Metal Stamping (except Automotive)"
2,332215,-0.26398646655403524,13,0.001000150097385869,"Metal Kitchen Cookware, Utensil, Cutlery, and Flatware (except Precious) Manufacturing"
2,332216,-0.7005028671166482,19,0.0012394479790550793,Saw Blade and Handtool Manufacturing
2,332311,-1.2074940196955655,23,0.0013014737147511528,Prefabricated Metal Building and Component Manufacturing
2,332312,-1.2302352974276776,24,0.0012942251169495902,Fabricated Structural Metal Manufacturing
2,332313,-1.119993738716172,24,0.0013090416037967074,Plate Work Manufacturing
2,332321,-1.3309230217101875,16,0.0011407844646990455,Metal Window and Door Manufacturing
2,332322,-1.1230613048374822,20,0.0012892085334774038,Sheet Metal Work Manufacturing
2,332323,-0.18411392332091325,19,0.0012256005878726163,Ornamental and Architectural Metal Work Manufacturing
2,332410,-0.8081573208876982,14,0.0010304235497161339,Power Boiler and Heat Exchanger Manufacturing
2,332420,-1.1958928073578636,22,0.0012386032286041961,Metal Tank (Heavy Gauge) Manufacturing
2,332431,-0.8254182296834927,17,0.001175983170058395,Metal Can Manufacturing
2,332439,-1.298836977368963,17,0.001197550017313571,Other Metal Container Manufacturing
2,332510,-1.4895260266444923,17,0.0012276024419754518,Hardware Manufacturing
2,332613,-1.6298111274560676,10,0.0008440483783349173,Spring Manufacturing
2,332618,-1.2986349372686146,18,0.001272608450293929,Other Fabricated Wire Product Manufacturing
2,332710,-0.8186710170054383,21,0.0012283867943155484,Machine Shops
2,332721,-0.49528312897407356,14,0.001053638279083971,Precision Turned Product Manufacturing
2,332722,-0.8484208679162502,16,0.0011543920697588944,"Bolt, Nut, Screw, Rivet, and Washer Manufacturing"
2,332811,-1.3505037817084296,11,0.0009450675181836749,Metal Heat Treating
2,332812,-1.141989849589127,17,0.00117776974843919,"Metal Coating, Engraving (except Jewelry and Silverware), and Allied Services to Manufacturers"
2,332813,-0.748134017221026,16,0.0011692148112155075,"Electroplating, Plating, Polishing, Anodizing, and Coloring"
2,332911,-1.0045139322033123,17,0.0011983762365282127,Industrial Valve Manufacturing
2,332912,-0.43823212975171527,16,0.0011296645513143584,Fluid Power Valve and Hose Fitting Manufacturing
2,332913,-1.04384922435156,14,0.0011293128645797324,Plumbing Fixture Fitting and Trim Manufacturing
2,332919,-0.8646555136620467,17,0.0012482210290850064,Other Metal Valve and Pipe Fitting Manufacturing
2,332991,-1.4546358352898887,12,0.0009936836254020314,Ball and Roller Bearing Manufacturing
2,332992,-0.9076608910488624,12,0.0009105133603368594,Small Arms Ammunition Manufacturing
2,332993,-1.8478118331056526,6,0.0005170279737168631,Ammunition (except Small Arms) Manufacturing
2,332994,-0.13172689625493064,22,0.0012718887051392876,"Small Arms, Ordnance, and Ordnance Accessories Manufacturing"
2,332996,-1.2573422505123086,14,0.0010472926919619016,Fabricated Pipe and Pipe Fitting Manufacturing
2,332999,-0.9419611406901687,16,0.001200876608848055,All Other Miscellaneous Fabricated Metal Product Manufacturing
2,333111,-1.6684927624336998,13,0.0009384717396242854,Farm Machinery and Equipment Manufacturing
2,333112,-1.215487281535316,14,0.0010373987238396878,Lawn and Garden Tractor and Home Lawn and Garden Equipment Manufacturing
2,333120,-1.3630036133588674,16,0.0011379730309688599,Construction Machinery Manufacturing
2,333131,-0.8770131863820938,17,0.0011582875619955755,Mining Machinery and Equipment Manufacturing
2,333132,-0.39028024101579656,5,0.0003232092851821482,Oil and Gas Field Machinery and Equipment Manufacturing
2,333241,-0.910298184681776,16,0.0011613813741938584,Food Product Machinery Manufacturing
2,333242,1.7097853745323939,7,0.0005420279400367502,Semiconductor Machinery Manufacturing
2,333243,-0.721819090262852,16,0.0011020699435738382,"Sawmill, Woodworking, and Paper Machinery Manufacturing"
2,333248,-1.1135099974129161,16,0.001194208825026667,All Other Industrial Machinery Manufacturing
2,333310,-0.3798179283632252,20,0.0012163703665691666,Commercial and Service Industry Machinery Manufacturing
2,333413,-1.677510594931186,15,0.0011567433745119792,Industrial and Commercial Fan and Blower and Air Purification Equipment Manufacturing
2,333414,-0.43686522238064696,21,0.0012532160211459465,Heating Equipment (except Warm Air Furnaces) Manufacturing
2,333415,-1.5866881366672216,15,0.0010842644638786759,Air-Conditioning and Warm Air Heating Equipment and Commercial and Industrial Refrigeration Equipment Manufacturing
2,333511,-1.747177615595475,14,0.0010938442386322375,Industrial Mold Manufacturing
2,333514,-1.2510775439415909,12,0.001017693162690357,"Special Die and Tool, Die Set, Jig, and Fixture Manufacturing"
2,333515,-0.9867229735891568,17,0.0012229741372572884,Cutting Tool and Machine Tool Accessory Manufacturing
2,333517,-0.8998241572774959,13,0.0010018828010447153,Machine Tool Manufacturing
2,333519,-0.3361062740305498,11,0.0008310703998460222,Rolling Mill and Other Metalworking Machinery Manufacturing
2,333611,-0.010209199849720794,13,0.0009583592961932453,Turbine and Turbine Generator Set Units Manufacturing
2,333612,-0.9268168187669233,13,0.0010067242034206153,"Speed Changer, Industrial High-Speed Drive, and Gear Manufacturing"
2,333613,-0.8379515005100573,19,0.0012883990767987236,Mechanical Power Transmission Equipment Manufacturing
2,333618,-1.336476108634132,13,0.001035968085411367,Other Engine Equipment Manufacturing
2,333912,-1.0391127546721397,15,0.0011043164628804754,Air and Gas Compressor Manufacturing
2,333914,-1.1752885896412069,19,0.0012297075474533015,"Measuring, Dispensing, and Other Pumping Equipment Manufacturing"
2,333921,-0.8219547450346978,12,0.000989936670492631,Elevator and Moving Stairway Manufacturing
2,333922,-1.4620984408472073,19,0.001226586902348624,Conveyor and Conveying Equipment Manufacturing
2,333923,-1.1076786611373333,17,0.0011871295570092034,"Overhead Traveling Crane, Hoist, and Monorail System Manufacturing"
2,333924,-1.2298054778805385,16,0.0011250385393067087,"Industrial Truck, Tractor, Trailer, and Stacker Machinery Manufacturing"
2,333991,-0.8560378469111543,10,0.0007669111053487274,Power-Driven Handtool Manufacturing
2,333992,-1.372304351750949,11,0.0008980693601452331,Welding and Soldering Equipment Manufacturing
2,333993,-1.005246948966803,14,0.0011168464459077217,Packaging Machinery Manufacturing
2,333994,-0.7405677543536401,11,0.0009341696098517946,Industrial Process Furnace and Oven Manufacturing
2,333995,-1.7840303995080966,15,0.0011234170300320936,Fluid Power Cylinder and Actuator Manufacturing
2,333996,-1.1249779742349912,12,0.0009286245947149923,Fluid Power Pump and Motor Manufacturing
2,333998,-0.8690175997070942,16,0.0011538845790580495,All Other Miscellaneous General Purpose Machinery Manufacturing
2,334111,0.9062953757484722,9,0.0006962678915261811,Electronic Computer Manufacturing
2,334112,1.255911092348238,5,0.00040426656540243957,Computer Storage Device Manufacturing
2,334118,0.2509605239162732,12,0.0009285589663257564,Computer Terminal and Other Computer Peripheral Equipment Manufacturing
2,334210,-0.6371582830919731,10,0.0007861633266463589,Telephone Apparatus Manufacturing
2,334220,0.711732347955852,14,0.0009526983388257334,Radio and Television Broadcasting and Wireless Communications Equipment Manufacturing
2,334290,0.8640105931999447,17,0.0012047057216400983,Other Communications Equipment Manufacturing
2,334310,0.26712730196144174,11,0.0008260962838669883,Audio and Video Equipment Manufacturing
2,334412,0.42336832584303635,15,0.0011361250872586825,Bare Printed Circuit Board Manufacturing
2,334413,1.4713173494559064,8,0.0006059654962572112,Semiconductor and Related Device Manufacturing
2,334416,0.45120733454477757,16,0.0010737626934229608,"Capacitor, Resistor, Coil, Transformer, and Other Inductor Manufacturing"
2,334417,0.37845167448598105,14,0.00104787129768071,Electronic Connector Manufacturing
2,334418,-0.1827762553268773,16,0.001193520354487146,Printed Circuit Assembly (Electronic Assembly) Manufacturing
2,334419,0.0867457226847965,15,0.001075654427700173,Other Electronic Component Manufacturing
2,334510,1.405299738567468,9,0.0006603540035741801,Electromedical and Electrotherapeutic Apparatus Manufacturing
2,334511,1.7699722539150473,12,0.0008937682374972837,"Search, Detection, Navigation, Guidance, Aeronautical, and Nautical System and Instrument Manufacturing"
2,334512,-0.9300753234386303,13,0.001025619182073175,"Automatic Environmental Control Manufacturing for Residential, Commercial, and Appliance Use"
2,334513,-0.30490598831786164,19,0.001222849574891812,"Instruments and Related Products Manufacturing for Measuring, Displaying, and Controlling Industrial Process Variables"
2,334514,-0.6720718990617343,12,0.0008886208752485914,Totalizing Fluid Meter and Counting Device Manufacturing
2,334515,1.1619882351730544,10,0.0008246953843963974,Instrument Manufacturing for Measuring and Testing Electricity and Electrical Signals
2,334516,1.0635892481967193,15,0.0009765799239405935,Analytical Laboratory Instrument Manufacturing
2,334517,1.4269283727285833,8,0.0006614460113824356,Irradiation Apparatus Manufacturing
2,334519,0.845313585311265,12,0.0009268131923359025,Other Measuring and Controlling Device Manufacturing
2,334610,0.09215224784639486,11,0.0009200900745562767,Manufacturing and Reproducing Magnetic and Optical Media
2,335131,-0.0938191971266906,13,0.0010052639900792564,Residential Electric Lighting Fixture Manufacturing
2,335132,-0.12305231797862476,17,0.0012005420323029728,"Commercial, Industrial, and Institutional Electric Lighting Fixture Manufacturing"
2,335139,-0.3355228616988127,12,0.0009085978868516716,Electric Lamp Bulb and Other Lighting Equipment Manufacturing
2,335210,-0.4392551542704776,9,0.0007532397882844999,Small Electrical Appliance Manufacturing
2,335220,-1.9733521267844563,11,0.0009059104707576849,Major Household Appliance Manufacturing
2,335311,-1.3942477808550684,13,0.0009119126921310088,"Power, Distribution, and Specialty Transformer Manufacturing"
2,335312,-1.5544089660199614,17,0.00117748115062081,Motor and Generator Manufacturing
2,335313,-1.09570489792232,15,0.0011117887422727535,Switchgear and Switchboard Apparatus Manufacturing
2,335314,-0.11423748819744947,13,0.0010154087606147582,Relay and Industrial Control Manufacturing
2,335910,-1.2807424322988592,13,0.0009951711076938185,Battery Manufacturing
2,335921,0.148650412324427,9,0.0007172809594193824,Fiber Optic Cable Manufacturing
2,335929,-0.36719977407916216,15,0.0011338869145085077,Other Communication and Energy Wire Manufacturing
2,335931,-0.8178604409668391,15,0.0011282734810548073,Current-Carrying Wiring Device Manufacturing
2,335932,-1.285047170045492,12,0.0009902225014529339,Noncurrent-Carrying Wiring Device Manufacturing
2,335991,-0.9380827215723828,16,0.0011138987790065835,Carbon and Graphite Product Manufacturing
2,335999,0.6512813400131627,16,0.001145847135957051,All Other Miscellaneous Electrical Equipment and Component Manufacturing
2,336110,-2.0816642018245033,10,0.0008637459750719626,Automobile and Light Duty Motor Vehicle Manufacturing
2,336120,-0.9993837528837656,15,0.0010336125978700603,Heavy Duty Truck Manufacturing
2,336211,-1.8462023137539365,15,0.0011353811350934846,Motor Vehicle Body Manufacturing
2,336212,-1.4840849086709693,21,0.0012461024994299779,Truck Trailer Manufacturing
2,336213,-1.9231487638681242,4,0.00032354434311168885,Motor Home Manufacturing
2,336214,-0.9465538627055575,11,0.0008221134972219177,Travel Trailer and Camper Manufacturing
2,336310,-1.9546832801230796,13,0.0009949752513612614,Motor Vehicle Gasoline Engine and Engine Parts Manufacturing
2,336320,-1.8710765134348826,12,0.0009532283551967358,Motor Vehicle Electrical and Electronic Equipment Manufacturing
2,336330,-1.508817728750129,11,0.0009062988632007975,Motor Vehicle Steering and Suspension Components (except Spring) Manufacturing
2,336340,-1.9894372139251033,9,0.0007901162198264376,Motor Vehicle Brake System Manufacturing
2,336350,-2.1615258338368815,9,0.0007458617330058093,Motor Vehicle Transmission and Power Train Parts Manufacturing
2,336360,-2.047375613330197,11,0.0008996313223941339,Motor Vehicle Seating and Interior Trim Manufacturing
2,336370,-2.1259095769590886,11,0.0008806265922072233,Motor Vehicle Metal Stamping
2,336390,-1.6882340944106133,15,0.0011614041682350231,Other Motor Vehicle Parts Manufacturing
2,336411,-0.17549328305328957,11,0.0008416736996546396,Aircraft Manufacturing
2,336412,0.18402701176994818,12,0.0009362174007925806,Aircraft Engine and Engine Parts Manufacturing
2,336413,-0.4188400581986809,17,0.0010880513110313706,Other Aircraft Parts and Auxiliary Equipment Manufacturing
2,336414,1.598779880372887,8,0.0006536599040314754,Guided Missile and Space Vehicle Manufacturing
2,336415,-0.41867225603517527,12,0.0008431789106822631,Guided Missile and Space Vehicle Propulsion Unit and Propulsion Unit Parts Manufacturing
2,336419,-0.18442556060135568,5,0.00041365493449434574,Other Guided Missile and Space Vehicle Parts and Auxiliary Equipment Manufacturing
2,336510,-0.30765141360151127,16,0.0011683121697490019,Railroad Rolling Stock Manufacturing
2,336611,0.25774720882780944,10,0.000654901066464052,Ship Building and Repairing
2,336612,-0.3412064817341727,17,0.0011496496351288937,Boat Building
2,336991,-0.03354342682172869,9,0.0007895140006925943,"Motorcycle, Bicycle, and Parts Manufacturing"
2,336992,-1.4510893885366836,10,0.0008211811917623193,"Military Armored Vehicle, Tank, and Tank Component Manufacturing"
2,336999,-1.817387099966927,10,0.0007685111100118725,All Other Transportation Equipment Manufacturing
2,337110,-1.155954466494154,21,0.0012759709524503685,Wood Kitchen Cabinet and Countertop Manufacturing
2,337121,-1.664952738710875,7,0.0005710396232762803,Upholstered Household Furniture Manufacturing
2,337122,0.0019154200268723311,20,0.001152035599279957,Nonupholstered Wood Household Furniture Manufacturing
2,337126,-0.7231709099269522,9,0.0007393665793836424,Household Furniture (except Wood and Upholstered) Manufacturing
2,337127,-1.0290760379964106,16,0.0011610719804511062,Institutional Furniture Manufacturing
2,337211,-1.4790881590642742,7,0.000568157668377793,Wood Office Furniture Manufacturing
2,337212,0.4584575190425265,22,0.001259281670618161,Custom Architectural Woodwork and Millwork Manufacturing
2,337214,-0.725735388282677,9,0.0007003988327798911,Office Furniture (except Wood) Manufacturing
2,337215,-1.387894548285658,21,0.0013245011505767339,"Showcase, Partition, Shelving, and Locker Manufacturing"
2,337910,-0.21191519305495204,17,0.0011648872734209136,Mattress Manufacturing
2,337920,0.6744753273528882,16,0.0010814080616306538,Blind and Shade Manufacturing
2,339112,0.5726080676702137,15,0.00113456446126498,Surgical and Medical Instrument Manufacturing
2,339113,-0.21403003037460078,17,0.0011820525413730027,Surgical Appliance and Supplies Manufacturing
2,339114,0.8635835791004599,11,0.0008802453592536551,Dental Equipment and Supplies Manufacturing
2,339115,0.8093711743192469,11,0.0009173626628659387,Ophthalmic Goods Manufacturing
2,339116,0.07920665738640992,15,0.0011532248808006132,Dental Laboratories
2,339910,1.4870669162405965,14,0.0009492888582273598,Jewelry and Silverware Manufacturing
2,339920,-0.41863412956866536,19,0.0012546365026144038,Sporting and Athletic Goods Manufacturing
2,339930,0.670397256364165,15,0.0010232022223551497,"Doll, Toy, and Game Manufacturing"
2,339940,-0.1127413576931509,12,0.0010336784331260644,Office Supplies (except Paper) Manufacturing
